{
  "schema_version": "official_macro_source_preflight_v1",
  "adapter_version": "official_macro_adapters_v1",
  "generated_at": "2026-08-11T11:31:37.108578+00:00",
  "raw_provider_rows_committed": false,
  "checks": [
    {
      "provider": "ECB",
      "series_key": "BSI.M.U2.Y.U.A20T.A.I.U2.2240.Z01.A",
      "source": "ecb.BSI.M.U2.Y.U.A20T.A.I.U2.2240.Z01.A",
      "usage_mode": "PRIMARY",
      "request_url": "https://data-api.ecb.europa.eu/service/data/BSI/M.U2.Y.U.A20T.A.I.U2.2240.Z01.A?format=csvdata&detail=full&includeHistory=true&startPeriod=2025-01-01&endPeriod=2026-07-17",
      "content_type": "text/csv",
      "retrieved_at": "2026-08-11T11:31:39.534172+00:00",
      "payload_hash": "sha256:7eaef4b34b81f965d883f9a1baaa7ba54e747672c32ba58702451accb42de44a",
      "row_count": 18,
      "elapsed_ms": 2425.731,
      "pit_status": "AUTHORITATIVE_VINTAGE_HISTORY",
      "transport_status": "ACTIVE",
      "snapshot_readiness": "PREFLIGHT_ONLY",
      "reason": "authoritative_vintage_history_transport_verified"
    },
    {
      "provider": "ECB",
      "series_key": "EST.B.EU000A2X2A25.WT",
      "source": "ecb.EST.B.EU000A2X2A25.WT",
      "usage_mode": "PRIMARY",
      "request_url": "https://data-api.ecb.europa.eu/service/data/EST/B.EU000A2X2A25.WT?format=csvdata&detail=full&includeHistory=true&startPeriod=2025-01-01&endPeriod=2026-07-17",
      "content_type": "text/csv",
      "retrieved_at": "2026-08-11T11:31:43.027508+00:00",
      "payload_hash": "sha256:6a7fd33eee651b38d34defc366950df2c7656c5024fe0576413cb4111457045b",
      "row_count": 393,
      "elapsed_ms": 3495.196,
      "pit_status": "AUTHORITATIVE_VINTAGE_HISTORY",
      "transport_status": "ACTIVE",
      "snapshot_readiness": "PREFLIGHT_ONLY",
      "reason": "authoritative_vintage_history_transport_verified"
    },
    {
      "provider": "ECB",
      "series_key": "EXR.D.USD.EUR.SP00.A",
      "source": "ecb.EXR.D.USD.EUR.SP00.A",
      "usage_mode": "PRIMARY",
      "request_url": "https://data-api.ecb.europa.eu/service/data/EXR/D.USD.EUR.SP00.A?format=csvdata&detail=full&includeHistory=true&startPeriod=2025-01-01&endPeriod=2026-07-17",
      "content_type": "text/csv",
      "retrieved_at": "2026-08-11T11:31:45.858365+00:00",
      "payload_hash": "sha256:efeb5f35c89d74589f3fc838dec5af7f41cfda99c6f1d88d7fe132da2524f188",
      "row_count": 393,
      "elapsed_ms": 2830.531,
      "pit_status": "AUTHORITATIVE_VINTAGE_HISTORY",
      "transport_status": "ACTIVE",
      "snapshot_readiness": "PREFLIGHT_ONLY",
      "reason": "authoritative_vintage_history_transport_verified"
    },
    {
      "provider": "ECB",
      "series_key": "FM.B.U2.EUR.4F.KR.DFR.LEV",
      "source": "ecb.FM.B.U2.EUR.4F.KR.DFR.LEV",
      "usage_mode": "PRIMARY",
      "request_url": "https://data-api.ecb.europa.eu/service/data/FM/B.U2.EUR.4F.KR.DFR.LEV?format=csvdata&detail=full&includeHistory=true&startPeriod=2025-01-01&endPeriod=2026-07-17",
      "content_type": "text/csv",
      "retrieved_at": "2026-08-11T11:31:47.403214+00:00",
      "payload_hash": "sha256:a7b33bd74bb7e3a95cfd66695ba3e9a80bdbae40e159686bdb1ce73763584d3a",
      "row_count": 5,
      "elapsed_ms": 1543.02,
      "pit_status": "AUTHORITATIVE_VINTAGE_HISTORY",
      "transport_status": "ACTIVE",
      "snapshot_readiness": "PREFLIGHT_ONLY",
      "reason": "authoritative_vintage_history_transport_verified"
    },
    {
      "provider": "ECB",
      "series_key": "FM.B.U2.EUR.4F.KR.MRR_FR.LEV",
      "source": "ecb.FM.B.U2.EUR.4F.KR.MRR_FR.LEV",
      "usage_mode": "PRIMARY",
      "request_url": "https://data-api.ecb.europa.eu/service/data/FM/B.U2.EUR.4F.KR.MRR_FR.LEV?format=csvdata&detail=full&includeHistory=true&startPeriod=2025-01-01&endPeriod=2026-07-17",
      "content_type": "text/csv",
      "retrieved_at": "2026-08-11T11:31:53.250902+00:00",
      "payload_hash": "sha256:d3afb94965ccad4258c6658cf60f1c856af168d38f496d4951856b7d4d8faeb5",
      "row_count": 5,
      "elapsed_ms": 5847.517,
      "pit_status": "AUTHORITATIVE_VINTAGE_HISTORY",
      "transport_status": "ACTIVE",
      "snapshot_readiness": "PREFLIGHT_ONLY",
      "reason": "authoritative_vintage_history_transport_verified"
    },
    {
      "provider": "ECB",
      "series_key": "HICP.M.B6.N.000000.4D0.ANR",
      "source": "ecb.HICP.M.B6.N.000000.4D0.ANR",
      "usage_mode": "PRIMARY",
      "request_url": "https://data-api.ecb.europa.eu/service/data/HICP/M.B6.N.000000.4D0.ANR?format=csvdata&detail=full&includeHistory=true&startPeriod=2025-01-01&endPeriod=2026-07-17",
      "content_type": "text/csv",
      "retrieved_at": "2026-08-11T11:31:55.094099+00:00",
      "payload_hash": "sha256:132714c6134bc98689676dc545053a7eb1d813689cc7f0533a39ba4dfee694f2",
      "row_count": 18,
      "elapsed_ms": 1843.218,
      "pit_status": "AUTHORITATIVE_VINTAGE_HISTORY",
      "transport_status": "ACTIVE",
      "snapshot_readiness": "PREFLIGHT_ONLY",
      "reason": "authoritative_vintage_history_transport_verified"
    },
    {
      "provider": "ECB",
      "series_key": "LFSI.M.B6.S.UNEHRT.TOTAL0.15_74.T",
      "source": "ecb.LFSI.M.B6.S.UNEHRT.TOTAL0.15_74.T",
      "usage_mode": "PRIMARY",
      "request_url": "https://data-api.ecb.europa.eu/service/data/LFSI/M.B6.S.UNEHRT.TOTAL0.15_74.T?format=csvdata&detail=full&includeHistory=true&startPeriod=2025-01-01&endPeriod=2026-07-17",
      "content_type": "text/csv",
      "retrieved_at": "2026-08-11T11:31:56.836891+00:00",
      "payload_hash": "sha256:883c9c9a70e8836262b2834b9a6c5fb7473e08f3d1831266e8e02f667261d427",
      "row_count": 18,
      "elapsed_ms": 1742.881,
      "pit_status": "AUTHORITATIVE_VINTAGE_HISTORY",
      "transport_status": "ACTIVE",
      "snapshot_readiness": "PREFLIGHT_ONLY",
      "reason": "authoritative_vintage_history_transport_verified"
    },
    {
      "provider": "ECB",
      "series_key": "MIR.M.U2.B.A2A.A.R.A.2240.EUR.N",
      "source": "ecb.MIR.M.U2.B.A2A.A.R.A.2240.EUR.N",
      "usage_mode": "PRIMARY",
      "request_url": "https://data-api.ecb.europa.eu/service/data/MIR/M.U2.B.A2A.A.R.A.2240.EUR.N?format=csvdata&detail=full&includeHistory=true&startPeriod=2025-01-01&endPeriod=2026-07-17",
      "content_type": "text/csv",
      "retrieved_at": "2026-08-11T11:31:58.762566+00:00",
      "payload_hash": "sha256:0697f168fdf92d94fdc3cbccea219183f1704e1d07fc1d4940dbd534df99d961",
      "row_count": 18,
      "elapsed_ms": 1925.53,
      "pit_status": "AUTHORITATIVE_VINTAGE_HISTORY",
      "transport_status": "ACTIVE",
      "snapshot_readiness": "PREFLIGHT_ONLY",
      "reason": "authoritative_vintage_history_transport_verified"
    },
    {
      "provider": "ECB",
      "series_key": "MNA.Q.N.B6.W1.S1.S1.C.P7._Z._Z._Z.EUR.LR.N",
      "source": "ecb.MNA.Q.N.B6.W1.S1.S1.C.P7._Z._Z._Z.EUR.LR.N",
      "usage_mode": "PRIMARY",
      "request_url": "https://data-api.ecb.europa.eu/service/data/MNA/Q.N.B6.W1.S1.S1.C.P7._Z._Z._Z.EUR.LR.N?format=csvdata&detail=full&includeHistory=true&startPeriod=2025-01-01&endPeriod=2026-07-17",
      "content_type": "text/csv",
      "retrieved_at": "2026-08-11T11:32:02.996884+00:00",
      "payload_hash": "sha256:68766c96328ca00a94b07993b3be74156e74c572920ffb435e4cffb1c3bd0391",
      "row_count": 5,
      "elapsed_ms": 4234.217,
      "pit_status": "AUTHORITATIVE_VINTAGE_HISTORY",
      "transport_status": "ACTIVE",
      "snapshot_readiness": "PREFLIGHT_ONLY",
      "reason": "authoritative_vintage_history_transport_verified"
    },
    {
      "provider": "ECB",
      "series_key": "MNA.Q.N.B6.W1.S1.S1.D.P6._Z._Z._Z.EUR.LR.N",
      "source": "ecb.MNA.Q.N.B6.W1.S1.S1.D.P6._Z._Z._Z.EUR.LR.N",
      "usage_mode": "PRIMARY",
      "request_url": "https://data-api.ecb.europa.eu/service/data/MNA/Q.N.B6.W1.S1.S1.D.P6._Z._Z._Z.EUR.LR.N?format=csvdata&detail=full&includeHistory=true&startPeriod=2025-01-01&endPeriod=2026-07-17",
      "content_type": "text/csv",
      "retrieved_at": "2026-08-11T11:32:04.513872+00:00",
      "payload_hash": "sha256:1a602ff059383b263611fc40b874d92bb76f9e9332a98ee3f3475504d62da52a",
      "row_count": 5,
      "elapsed_ms": 1516.94,
      "pit_status": "AUTHORITATIVE_VINTAGE_HISTORY",
      "transport_status": "ACTIVE",
      "snapshot_readiness": "PREFLIGHT_ONLY",
      "reason": "authoritative_vintage_history_transport_verified"
    },
    {
      "provider": "ECB",
      "series_key": "MNA.Q.Y.B6.W0.S1M.S1.D.P31._Z._Z._T.EUR.LR.N",
      "source": "ecb.MNA.Q.Y.B6.W0.S1M.S1.D.P31._Z._Z._T.EUR.LR.N",
      "usage_mode": "PRIMARY",
      "request_url": "https://data-api.ecb.europa.eu/service/data/MNA/Q.Y.B6.W0.S1M.S1.D.P31._Z._Z._T.EUR.LR.N?format=csvdata&detail=full&includeHistory=true&startPeriod=2025-01-01&endPeriod=2026-07-17",
      "content_type": "text/csv",
      "retrieved_at": "2026-08-11T11:32:05.807851+00:00",
      "payload_hash": "sha256:fe8976f9a35e35972b69b717039411b6f784f10996643ac80561f15e4b96faec",
      "row_count": 5,
      "elapsed_ms": 1293.921,
      "pit_status": "AUTHORITATIVE_VINTAGE_HISTORY",
      "transport_status": "ACTIVE",
      "snapshot_readiness": "PREFLIGHT_ONLY",
      "reason": "authoritative_vintage_history_transport_verified"
    },
    {
      "provider": "ECB",
      "series_key": "MNA.Q.Y.B6.W2.S1.S1.B.B1GQ._Z._Z._Z.EUR.LR.N",
      "source": "ecb.MNA.Q.Y.B6.W2.S1.S1.B.B1GQ._Z._Z._Z.EUR.LR.N",
      "usage_mode": "PRIMARY",
      "request_url": "https://data-api.ecb.europa.eu/service/data/MNA/Q.Y.B6.W2.S1.S1.B.B1GQ._Z._Z._Z.EUR.LR.N?format=csvdata&detail=full&includeHistory=true&startPeriod=2025-01-01&endPeriod=2026-07-17",
      "content_type": "text/csv",
      "retrieved_at": "2026-08-11T11:32:06.978006+00:00",
      "payload_hash": "sha256:67ed3154ce2784b8b0cbe32c92b3819a02197e29ffa1f0f1eb75157d6e00bbd8",
      "row_count": 6,
      "elapsed_ms": 1170.171,
      "pit_status": "AUTHORITATIVE_VINTAGE_HISTORY",
      "transport_status": "ACTIVE",
      "snapshot_readiness": "PREFLIGHT_ONLY",